{
  "contract_version": "conversation/v1",
  "id": "conv-20261028-090000-a1b2c3",
  "state": "idle",
  "repository": { "path": "acme/widgets", "commit": "0123456789abcdef0123456789abcdef01234567" },
  "runtime": "fake",
  "created_at": "2026-10-28T09:00:00Z",
  "updated_at": "2026-10-28T09:00:01Z",
  "messages": 0,
  "queued": 0,
  "pending_approvals": [],
  "caps": { "max_messages": 200 },
  "last_event_id": 2
}
