{
  "contract_version": "conversation/v1",
  "id": "conv-20261028-090000-a1b2c3",
  "state": "running",
  "repository": { "path": "acme/widgets", "commit": "0123456789abcdef0123456789abcdef01234567" },
  "runtime": "acp:gemini",
  "model": "gemini-2.5-pro",
  "preset": "cheap",
  "actor": "alice",
  "created_at": "2026-10-28T09:00:00Z",
  "updated_at": "2026-10-28T09:03:12Z",
  "messages": 2,
  "queued": 1,
  "pending_approvals": ["call-7"],
  "usage": { "input_tokens": 5400, "output_tokens": 310, "usd": 0.021 },
  "caps": { "max_messages": 200 },
  "last_event_id": 31
}
